{"$schema":"https://json-schema.org/draft/2020-12/schema","title":"Digital Laboratory Experiment Record","type":"object","required":["schema_version","program_id","experiment_id","run_id","title","execution_class","lifecycle_state","evidence_state","disposition","provenance"],"properties":{"schema_version":{"type":"string"},"program_id":{"type":"string"},"experiment_id":{"type":"string"},"run_id":{"type":"string"},"title":{"type":"string"},"execution_class":{"enum":["DESIGN_ONLY","SYNTHETIC","SIMULATION","PHYSICAL","FIELD"]},"lifecycle_state":{"enum":["PROPOSED","AUTHORIZED","EXECUTING","EXECUTED","REVIEWED","CLOSED"]},"evidence_state":{"enum":["NONE","THREAD_BOUND","PARTIAL","VERIFIED","REPLICATED","INVALID"]},"artifacts":{"type":"array"},"disposition":{"type":"object"},"provenance":{"type":"object"}},"additionalProperties":true}