{"schema_version":"digital-laboratory/experiment/v0.1","program_id":"GROWN-CIRCUITRY","experiment_id":"GC-001","run_id":"GC-001-DL-001","title":"Synthetic Discrimination Test","execution_class":"SYNTHETIC","lifecycle_state":"EXECUTED","evidence_state":"PARTIAL","disposition":{"state":"PASS_ANALYSIS_PIPELINE","claim_boundary":"Synthetic analysis logic behaved as intended; this is not evidence of a physical biological signal.","next_gate":"Prepare a separately authorized Phase B feasibility run only after source, instrumentation, controls, containment, and provenance capture are locked."},"provenance":{"source_lineage":["ChatGPT temporary digital bench","GC-001 generated artifacts"],"reproducibility_gaps":["generator code not yet ingested","analysis code not yet ingested","exact runtime environment not preserved"]}}